{
  "schema_version": 1,
  "contract_sha256": "ce8c3bc939484c51b9e56cf8be040809c2d3e238e17863177e007e16eee61f89",
  "objective_sha256": "463fa7015808acd883b28d115fa33708f66064aaceed96f728996a01ca0e4091",
  "freshness_epoch": "sm110a-codegen-v2-20260830",
  "result_id": "phase1-generalized-20260830.dense_bs_mxf8_1sm.a001",
  "scope": "STATIC_CODEGEN_ONLY",
  "subject": {
    "kind": "explicit_schedule_tag",
    "id": "KernelTmaWarpSpecialized1SmMxf8f6f4Sm100",
    "group": "dense_block_scaled"
  },
  "instance_ref": {
    "id": "dense_bs_mxf8_1sm",
    "path": "tests/codegen/instances/dense_bs_mxf8_1sm/instance.json",
    "sha256": "ca49642269d337b5e58aed224fda78181246aef60aae9027d1c0703fcb3fcc2a"
  },
  "fingerprint_ref": {
    "id": "fp-dense_bs_mxf8_1sm-2f9cdc09d239",
    "path": "evidence/codegen-sm110a-v2/fingerprints/fp-dense_bs_mxf8_1sm-2f9cdc09d239.json",
    "sha256": "32fb0b4b5028d76c71bb4d37d0c4a14cbd6dd1ba252fd7bd262663bdc0f1bfca"
  },
  "attempt_id": "phase1-generalized-20260830.dense_bs_mxf8_1sm.a001",
  "journal_ref": {
    "path": "evidence/codegen-sm110a-v2/journals/phase1-generalized-20260830.dense_bs_mxf8_1sm.a001.jsonl",
    "sha256": "798aaec576831d7875ae6b0bf3c1bf24eabaa03b99227cd58bd97ed345b58ffc",
    "last_seq": 64,
    "last_event_sha256": "bcf19906df1aa4b6494a054b93e2e51bb4d999eeec7f8442f430a8354dd06c83"
  },
  "artifact_manifest_ref": {
    "id": "am-phase1-generalized-20260830.dense_bs_mxf8_1sm.a001",
    "path": "evidence/codegen-sm110a-v2/artifact-manifests/am-phase1-generalized-20260830.dense_bs_mxf8_1sm.a001.json",
    "sha256": "04850ac3f06da4689277be57acda6bbc35015f7483175719303cd5721f8d87c6"
  },
  "status": "STATIC_PASS",
  "layer_outcomes": [
    {
      "layer": "DECLARED_BUILDER_CONFIG",
      "state": "RESOLVED",
      "witness_artifact_id": "config_source"
    },
    {
      "layer": "BUILDER_SPECIALIZATION",
      "state": "RESOLVED",
      "witness_artifact_id": "type_output"
    },
    {
      "layer": "DISPATCH_POLICY",
      "state": "RESOLVED",
      "witness_artifact_id": "type_output"
    },
    {
      "layer": "COLLECTIVE",
      "state": "RESOLVED",
      "witness_artifact_id": "type_output"
    },
    {
      "layer": "STAGE",
      "state": "RESOLVED",
      "witness_artifact_id": "type_output"
    },
    {
      "layer": "COPY_LAYOUT",
      "state": "RESOLVED",
      "witness_artifact_id": "type_output"
    },
    {
      "layer": "TILED_MMA",
      "state": "RESOLVED",
      "witness_artifact_id": "type_output"
    },
    {
      "layer": "ATOM",
      "state": "RESOLVED",
      "witness_artifact_id": "type_output"
    },
    {
      "layer": "KERNEL_COMPOSITION",
      "state": "RESOLVED",
      "witness_artifact_id": "type_output"
    },
    {
      "layer": "PTX_EMISSION",
      "state": "RESOLVED",
      "witness_artifact_id": "ptx_full"
    },
    {
      "layer": "SM110A_ASSEMBLY",
      "state": "RESOLVED",
      "witness_artifact_id": "cubin"
    },
    {
      "layer": "FUNCTION_BINDING",
      "state": "RESOLVED",
      "witness_artifact_id": "elf_symbols"
    },
    {
      "layer": "FUNCTION_CONTRACT",
      "state": "RESOLVED",
      "witness_artifact_id": "contract_report"
    }
  ],
  "evidence": {
    "kind": "STATIC_PASS",
    "type_witness_artifact_id": "type_output",
    "resolved_stage": {
      "declared_policy_cpp": "cutlass::gemm::collective::StageCountAutoCarveout<EpilogueSharedStorage>",
      "resolved_policy_cpp": "cutlass::gemm::collective::StageCountAutoCarveout<32>",
      "stage_count": 6,
      "scheduler_stages": 2,
      "accumulator_stages": 2,
      "load_to_transform_stages": 0,
      "transform_to_mma_stages": 0,
      "computation_stages": 0,
      "transformation_stages": 0
    },
    "function_binding": {
      "target_cpp_entity": "cutlass::device_kernel<GemmKernel>",
      "selection_policy": "sole_ptx_entry_equals_sole_elf_sto_entry_equals_unique_nvdisasm_function",
      "symbol": "_ZN7cutlass13device_kernelINS_4gemm6kernel13GemmUniversalIN4cute5tupleIJiiiiEEENS1_10collective13CollectiveMmaINS1_46MainloopSm100TmaUmmaWarpSpecializedBlockScaledILi6ELi2ELi2ENS5_IJNS4_1CILi1EEESB_SB_EEENS_4arch5Sm100EEENS5_IJNSA_ILi128EEESG_SG_EEENS5_IJNS_12float_e4m3_tENS_13float_ue8m0_tEEEENS5_IJNS5_IJlSB_lEEENS4_6LayoutINS5_IJNS5_IJNS5_IJNSA_ILi32EEENSA_ILi4EEEEEEiEEESQ_NS5_IJSB_iEEEEEENS5_IJNS5_IJNS5_IJNSA_ILi16EEESO_EEEiEEENS5_IJNS5_IJNSA_ILi0EEESB_EEENSA_ILi512EEEEEENS5_IJSW_iEEEEEEEEEEESK_S13_NS4_8TiledMMAINS4_8MMA_AtomIJNS4_21SM100_MMA_MXF8F6F4_SSISI_SI_fSJ_Li128ELi128ELNS4_4UMMA5MajorE0ELS18_0ELNS17_7ScaleInE0ELS19_0EEEEEENSM_ISC_NS5_IJSW_SW_SW_EEEEENS5_IJNS4_10UnderscoreES1E_S1E_EEEEENS5_IJNS4_13SM90_TMA_LOADES1H_EEENS5_IJNS4_14ComposedLayoutINS4_7SwizzleILi3ELi4ELi3EEENS4_18smem_ptr_flag_bitsILi8EEENSM_INS5_IJNSA_ILi8EEESG_EEENS5_IJSG_SB_EEEEEEENSM_INS5_IJNS5_IJNS5_IJSP_SB_EEENS5_IJSN_SB_EEEEEESB_NS5_IJSO_SB_EEEEEENS5_IJNS5_IJNS5_IJSU_SY_EEESX_EEESW_NS5_IJSB_SY_EEEEEEEEEEEvNS4_8identityES1I_S23_vS24_EENS_8epilogue10collective18CollectiveEpilogueINS26_26Sm100NoSmemWarpSpecializedEJNS5_IJSG_NSA_ILi64EEEEEEvSL_NS_10bfloat16_tESL_NS26_6fusion15FusionCallbacksIS29_NS2D_17LinearCombinationIS2C_fvfLNS_15FloatRoundStyleE2EEESH_S2B_JEEENS4_5SM1004TMEM4LOAD26SM100_TMEM_LOAD_32dp32b64xESB_S1O_EEEvvEEEEvNT_6ParamsE",
      "ptx_entry_count": 1,
      "elf_sto_entry_count": 1,
      "nvdisasm_symbol_match_count": 1,
      "nvdisasm_total_function_count": 4,
      "ptx_function_artifact_id": "ptx_target",
      "sass_function_artifact_id": "sass_target",
      "same_symbol": true
    },
    "ptx_contract_results": [
      {
        "id": "tma_load",
        "required": true,
        "match_count": 8,
        "matched_opcodes": [
          "cp.async.bulk.tensor.3d.shared::cluster.global.mbarrier::complete_tx::bytes.L2::cache_hint",
          "cp.async.bulk.tensor.3d.shared::cluster.global.mbarrier::complete_tx::bytes.L2::cache_hint",
          "cp.async.bulk.tensor.4d.shared::cluster.global.mbarrier::complete_tx::bytes.L2::cache_hint",
          "cp.async.bulk.tensor.4d.shared::cluster.global.mbarrier::complete_tx::bytes.L2::cache_hint",
          "cp.async.bulk.tensor.3d.shared::cluster.global.mbarrier::complete_tx::bytes.L2::cache_hint",
          "cp.async.bulk.tensor.3d.shared::cluster.global.mbarrier::complete_tx::bytes.L2::cache_hint",
          "cp.async.bulk.tensor.4d.shared::cluster.global.mbarrier::complete_tx::bytes.L2::cache_hint",
          "cp.async.bulk.tensor.4d.shared::cluster.global.mbarrier::complete_tx::bytes.L2::cache_hint"
        ]
      },
      {
        "id": "tmem_load",
        "required": true,
        "match_count": 2,
        "matched_opcodes": [
          "tcgen05.ld.sync.aligned.32x32b.x64.b32",
          "tcgen05.ld.sync.aligned.32x32b.x64.b32"
        ]
      },
      {
        "id": "tmem_copy",
        "required": true,
        "match_count": 2,
        "matched_opcodes": [
          "tcgen05.cp.cta_group::1.32x128b.warpx4",
          "tcgen05.cp.cta_group::1.32x128b.warpx4"
        ]
      },
      {
        "id": "mma_blockscale_mxf8",
        "required": true,
        "match_count": 4,
        "matched_opcodes": [
          "tcgen05.mma.cta_group::1.kind::mxf8f6f4.block_scale",
          "tcgen05.mma.cta_group::1.kind::mxf8f6f4.block_scale",
          "tcgen05.mma.cta_group::1.kind::mxf8f6f4.block_scale",
          "tcgen05.mma.cta_group::1.kind::mxf8f6f4.block_scale"
        ]
      },
      {
        "id": "mma_2sm",
        "required": false,
        "match_count": 0,
        "matched_opcodes": []
      }
    ],
    "sass_contract_results": [
      {
        "id": "tma_load",
        "required": true,
        "match_count": 8,
        "matched_opcodes": [
          "UTMALDG.3D",
          "UTMALDG.3D",
          "UTMALDG.4D",
          "UTMALDG.4D",
          "UTMALDG.3D",
          "UTMALDG.3D",
          "UTMALDG.4D",
          "UTMALDG.4D"
        ]
      },
      {
        "id": "tmem_load",
        "required": true,
        "match_count": 2,
        "matched_opcodes": [
          "LDTM.X64",
          "LDTM.X64"
        ]
      },
      {
        "id": "tmem_copy",
        "required": true,
        "match_count": 2,
        "matched_opcodes": [
          "UTCCP.T.S.4X32DP128BIT",
          "UTCCP.T.S.4X32DP128BIT"
        ]
      },
      {
        "id": "mma_blockscale",
        "required": true,
        "match_count": 4,
        "matched_opcodes": [
          "UTCQMMA",
          "UTCQMMA",
          "UTCQMMA",
          "UTCQMMA"
        ]
      },
      {
        "id": "mma_2cta",
        "required": false,
        "match_count": 0,
        "matched_opcodes": []
      }
    ],
    "cta_group_contract_pass": true
  }
}
