{
  "schema_version": 1,
  "contract_sha256": "b4f228dc801f952f6d0942291986d6e9472b7efec006d9306451326d489901f3",
  "objective_sha256": "463fa7015808acd883b28d115fa33708f66064aaceed96f728996a01ca0e4091",
  "freshness_epoch": "sm110a-codegen-v2-20260830",
  "result_id": "phase1-generalized-20260830.dense_bs_mxf4_1sm.a001",
  "scope": "STATIC_CODEGEN_ONLY",
  "subject": {
    "kind": "explicit_schedule_tag",
    "id": "KernelTmaWarpSpecialized1SmMxf4Sm100",
    "group": "dense_block_scaled"
  },
  "instance_ref": {
    "id": "dense_bs_mxf4_1sm",
    "path": "tests/codegen/instances/dense_bs_mxf4_1sm/instance.json",
    "sha256": "cdabba2d723dc1192a04167319bb03d5d31bdc941a020bce940cd2d769ae22c0"
  },
  "fingerprint_ref": {
    "id": "fp-dense_bs_mxf4_1sm-2244639843b2",
    "path": "evidence/codegen-sm110a-v2/fingerprints/fp-dense_bs_mxf4_1sm-2244639843b2.json",
    "sha256": "7d0c9995f91c63f5b525becb813f56984fba89668bebd63bf93e5ac59b4bc172"
  },
  "attempt_id": "phase1-generalized-20260830.dense_bs_mxf4_1sm.a001",
  "journal_ref": {
    "path": "evidence/codegen-sm110a-v2/journals/phase1-generalized-20260830.dense_bs_mxf4_1sm.a001.jsonl",
    "sha256": "18bf91b79521166694c21cd460304ba259a1b5abd330afcc5e450a7bf0b8b32f",
    "last_seq": 64,
    "last_event_sha256": "79a3d2b914323084ff290fa3ada8662e8840b1445e639fd4bb4da60091cf5504"
  },
  "artifact_manifest_ref": {
    "id": "am-phase1-generalized-20260830.dense_bs_mxf4_1sm.a001",
    "path": "evidence/codegen-sm110a-v2/artifact-manifests/am-phase1-generalized-20260830.dense_bs_mxf4_1sm.a001.json",
    "sha256": "404eb47ed02b9685fb36bedccad5fefe10d3b5609edaf94fafbdf315502edb08"
  },
  "status": "STATIC_PASS",
  "layer_outcomes": [
    {
      "layer": "DECLARED_BUILDER_CONFIG",
      "state": "RESOLVED",
      "witness_artifact_id": "config_source"
    },
    {
      "layer": "BUILDER_SPECIALIZATION",
      "state": "RESOLVED",
      "witness_artifact_id": "type_output"
    },
    {
      "layer": "DISPATCH_POLICY",
      "state": "RESOLVED",
      "witness_artifact_id": "type_output"
    },
    {
      "layer": "COLLECTIVE",
      "state": "RESOLVED",
      "witness_artifact_id": "type_output"
    },
    {
      "layer": "STAGE",
      "state": "RESOLVED",
      "witness_artifact_id": "type_output"
    },
    {
      "layer": "COPY_LAYOUT",
      "state": "RESOLVED",
      "witness_artifact_id": "type_output"
    },
    {
      "layer": "TILED_MMA",
      "state": "RESOLVED",
      "witness_artifact_id": "type_output"
    },
    {
      "layer": "ATOM",
      "state": "RESOLVED",
      "witness_artifact_id": "type_output"
    },
    {
      "layer": "KERNEL_COMPOSITION",
      "state": "RESOLVED",
      "witness_artifact_id": "type_output"
    },
    {
      "layer": "PTX_EMISSION",
      "state": "RESOLVED",
      "witness_artifact_id": "ptx_full"
    },
    {
      "layer": "SM110A_ASSEMBLY",
      "state": "RESOLVED",
      "witness_artifact_id": "cubin"
    },
    {
      "layer": "FUNCTION_BINDING",
      "state": "RESOLVED",
      "witness_artifact_id": "elf_symbols"
    },
    {
      "layer": "FUNCTION_CONTRACT",
      "state": "RESOLVED",
      "witness_artifact_id": "contract_report"
    }
  ],
  "evidence": {
    "kind": "STATIC_PASS",
    "type_witness_artifact_id": "type_output",
    "resolved_stage": {
      "declared_policy_cpp": "cutlass::gemm::collective::StageCountAutoCarveout<EpilogueSharedStorage>",
      "resolved_policy_cpp": "cutlass::gemm::collective::StageCountAutoCarveout<32>",
      "stage_count": 6,
      "scheduler_stages": 2,
      "accumulator_stages": 2,
      "load_to_transform_stages": 0,
      "transform_to_mma_stages": 0,
      "computation_stages": 0,
      "transformation_stages": 0
    },
    "function_binding": {
      "target_cpp_entity": "cutlass::device_kernel<GemmKernel>",
      "selection_policy": "sole_ptx_entry_equals_sole_elf_sto_entry_equals_unique_nvdisasm_function",
      "symbol": "_ZN7cutlass13device_kernelINS_4gemm6kernel13GemmUniversalIN4cute5tupleIJiiiiEEENS1_10collective13CollectiveMmaINS1_46MainloopSm100TmaUmmaWarpSpecializedBlockScaledILi6ELi2ELi2ENS5_IJNS4_1CILi1EEESB_SB_EEENS_4arch5Sm100EEENS5_IJNSA_ILi128EEESG_NSA_ILi256EEEEEENS5_IJNS_12float_e2m1_tENS_13float_ue8m0_tEEEENS5_IJNS5_IJlSB_lEEENS4_6LayoutINS5_IJNS5_IJNS5_IJNSA_ILi32EEENSA_ILi4EEEEEEiEEESR_NS5_IJSB_iEEEEEENS5_IJNS5_IJNS5_IJNSA_ILi16EEESP_EEEiEEENS5_IJNS5_IJNSA_ILi0EEESB_EEENSA_ILi512EEEEEENS5_IJSX_iEEEEEEEEEEESL_S14_NS4_8TiledMMAINS4_8MMA_AtomIJNS4_17SM100_MMA_MXF4_SSISJ_SJ_fSK_Li128ELi128ELi32ELNS4_4UMMA5MajorE0ELS19_0ELNS18_7ScaleInE0ELS1A_0EEEEEENSN_ISC_NS5_IJSX_SX_SX_EEEEENS5_IJNS4_10UnderscoreES1F_S1F_EEEEENS5_IJNS4_13SM90_TMA_LOADES1I_EEENS5_IJNS4_14ComposedLayoutINS4_7SwizzleILi3ELi4ELi3EEENS4_18smem_ptr_flag_bitsILi4EEENSN_INS5_IJNSA_ILi8EEESH_EEENS5_IJSH_SB_EEEEEEENSN_INS5_IJNS5_IJNS5_IJSQ_SB_EEENS5_IJSO_NSA_ILi2EEEEEEEEESB_NS5_IJS1V_S1V_EEEEEENS5_IJNS5_IJNS5_IJSV_SZ_EEESY_EEESX_NS5_IJS1V_SZ_EEEEEEEEEEEvNS4_8identityES1J_S25_vS26_EENS_8epilogue10collective18CollectiveEpilogueINS28_26Sm100NoSmemWarpSpecializedEJNS5_IJSG_NSA_ILi64EEEEEEvSM_NS_10bfloat16_tESM_NS28_6fusion15FusionCallbacksIS2B_NS2F_17LinearCombinationIS2E_fvfLNS_15FloatRoundStyleE2EEESI_S2D_JEEENS4_5SM1004TMEM4LOAD26SM100_TMEM_LOAD_32dp32b64xESB_S1P_EEEvvEEEEvNT_6ParamsE",
      "ptx_entry_count": 1,
      "elf_sto_entry_count": 1,
      "nvdisasm_symbol_match_count": 1,
      "nvdisasm_total_function_count": 4,
      "ptx_function_artifact_id": "ptx_target",
      "sass_function_artifact_id": "sass_target",
      "same_symbol": true
    },
    "ptx_contract_results": [
      {
        "id": "tma_load",
        "required": true,
        "match_count": 8,
        "matched_opcodes": [
          "cp.async.bulk.tensor.3d.shared::cluster.global.mbarrier::complete_tx::bytes.L2::cache_hint",
          "cp.async.bulk.tensor.3d.shared::cluster.global.mbarrier::complete_tx::bytes.L2::cache_hint",
          "cp.async.bulk.tensor.4d.shared::cluster.global.mbarrier::complete_tx::bytes.L2::cache_hint",
          "cp.async.bulk.tensor.4d.shared::cluster.global.mbarrier::complete_tx::bytes.L2::cache_hint",
          "cp.async.bulk.tensor.3d.shared::cluster.global.mbarrier::complete_tx::bytes.L2::cache_hint",
          "cp.async.bulk.tensor.3d.shared::cluster.global.mbarrier::complete_tx::bytes.L2::cache_hint",
          "cp.async.bulk.tensor.4d.shared::cluster.global.mbarrier::complete_tx::bytes.L2::cache_hint",
          "cp.async.bulk.tensor.4d.shared::cluster.global.mbarrier::complete_tx::bytes.L2::cache_hint"
        ]
      },
      {
        "id": "tmem_load",
        "required": true,
        "match_count": 2,
        "matched_opcodes": [
          "tcgen05.ld.sync.aligned.32x32b.x64.b32",
          "tcgen05.ld.sync.aligned.32x32b.x64.b32"
        ]
      },
      {
        "id": "tmem_copy",
        "required": true,
        "match_count": 4,
        "matched_opcodes": [
          "tcgen05.cp.cta_group::1.32x128b.warpx4",
          "tcgen05.cp.cta_group::1.32x128b.warpx4",
          "tcgen05.cp.cta_group::1.32x128b.warpx4",
          "tcgen05.cp.cta_group::1.32x128b.warpx4"
        ]
      },
      {
        "id": "mma_blockscale_mxf4",
        "required": true,
        "match_count": 4,
        "matched_opcodes": [
          "tcgen05.mma.cta_group::1.kind::mxf4.block_scale.block32",
          "tcgen05.mma.cta_group::1.kind::mxf4.block_scale.block32",
          "tcgen05.mma.cta_group::1.kind::mxf4.block_scale.block32",
          "tcgen05.mma.cta_group::1.kind::mxf4.block_scale.block32"
        ]
      },
      {
        "id": "mma_2sm",
        "required": false,
        "match_count": 0,
        "matched_opcodes": []
      }
    ],
    "sass_contract_results": [
      {
        "id": "tma_load",
        "required": true,
        "match_count": 8,
        "matched_opcodes": [
          "UTMALDG.3D",
          "UTMALDG.3D",
          "UTMALDG.4D",
          "UTMALDG.4D",
          "UTMALDG.3D",
          "UTMALDG.3D",
          "UTMALDG.4D",
          "UTMALDG.4D"
        ]
      },
      {
        "id": "tmem_load",
        "required": true,
        "match_count": 2,
        "matched_opcodes": [
          "LDTM.X64",
          "LDTM.X64"
        ]
      },
      {
        "id": "tmem_copy",
        "required": true,
        "match_count": 4,
        "matched_opcodes": [
          "UTCCP.T.S.4X32DP128BIT",
          "UTCCP.T.S.4X32DP128BIT",
          "UTCCP.T.S.4X32DP128BIT",
          "UTCCP.T.S.4X32DP128BIT"
        ]
      },
      {
        "id": "mma_blockscale",
        "required": true,
        "match_count": 4,
        "matched_opcodes": [
          "UTCOMMA",
          "UTCOMMA",
          "UTCOMMA",
          "UTCOMMA"
        ]
      },
      {
        "id": "mma_2cta",
        "required": false,
        "match_count": 0,
        "matched_opcodes": []
      }
    ],
    "cta_group_contract_pass": true
  }
}
